id,name,text
1,Butterfly,"Butterflies are insects with large, often brightly colored wings. They belong to the order Lepidoptera and are important pollinators."
2,Ant,"Ants are social insects that live in colonies. They are known for their strength and complex social organization."
3,Beetle,"Beetles belong to the order Coleoptera, the largest group of insects. They have hardened forewings and diverse habitats."
4,Dragonfly,"Dragonflies are fast-flying insects with large multifaceted eyes and two pairs of strong transparent wings."
5,Mosquito,"Mosquitoes are small, midge-like flies. Some species are vectors of diseases like malaria and dengue."
